{
  "schema_version": "miskatonic.execution-trace.v0.1",
  "trace_id": "trace-smt-paired-fam-pos-06-r2-z3-real",
  "problem_id": "smt-paired-fam-pos-06-r2",
  "backend_id": "z3",
  "backend_version": "Z3 version 5.1.0 - 64 bit",
  "execution_origin": "EXECUTED_NATIVE",
  "logical_authority_class": "SOLVER_SAT_OR_UNSAT",
  "created_at": "2026-09-12T23:43:11.641801+00:00",
  "events": [
    {
      "event_id": "trace-smt-paired-fam-pos-06-r2-z3-real-ev-0000",
      "sequence": 0,
      "event_type": "INITIAL_PROBLEM",
      "backend_id": "z3",
      "backend_version": "Z3 version 5.1.0 - 64 bit",
      "parent_event_id": null,
      "state_digest": "d3678c554eed8b684a32cd735a105d52617f695afb4c12d79da96cff62bb32ba",
      "operation": "load_problem",
      "result_digest": "d3678c554eed8b684a32cd735a105d52617f695afb4c12d79da96cff62bb32ba",
      "provenance": {
        "timestamp": "2026-09-12T23:43:11.675201+00:00",
        "origin": "z3"
      },
      "logical_authority_class": "NONE",
      "event_origin": "CLIENT_DECLARED",
      "payload": {
        "formal_syntax": "; SMT Semantic Control (WO-MATH-FORMAL-DISCOVERY-01B Section 25)\n(declare-const kf Int)\n(assert (not (= kf kf)))\n(check-sat)\n",
        "goals": [
          "check-sat"
        ]
      }
    },
    {
      "event_id": "trace-smt-paired-fam-pos-06-r2-z3-real-ev-0001",
      "sequence": 1,
      "event_type": "TERMINAL_VERDICT",
      "backend_id": "z3",
      "backend_version": "Z3 version 5.1.0 - 64 bit",
      "parent_event_id": "trace-smt-paired-fam-pos-06-r2-z3-real-ev-0000",
      "state_digest": "d3678c554eed8b684a32cd735a105d52617f695afb4c12d79da96cff62bb32ba",
      "operation": "check_sat",
      "result_digest": "5c17dfcc2a8f1f30d9e96df6a9825a5030ade046d560332c19de74d93d591a18",
      "provenance": {
        "timestamp": "2026-09-12T23:43:11.675221+00:00",
        "origin": "z3"
      },
      "logical_authority_class": "SOLVER_SAT_OR_UNSAT",
      "event_origin": "BACKEND_OBSERVED",
      "payload": {
        "verdict": "UNSAT_REFUTED"
      }
    }
  ],
  "terminal_verdict": "UNSAT_REFUTED",
  "metrics": {
    "event_count": 2,
    "branch_count": 0,
    "wall_time_ms": 12.910604476928711
  },
  "problem_digest": "d3678c554eed8b684a32cd735a105d52617f695afb4c12d79da96cff62bb32ba",
  "execution_receipt": {
    "schema_version": "miskatonic.backend-execution-receipt.v0.1",
    "receipt_id": "rcpt-z3-smt-paired-fam-pos-06-r2-1789256591",
    "backend_id": "z3",
    "backend_family": "SMT_SOLVER",
    "execution_origin": "EXECUTED_NATIVE",
    "executable_path": "/home/linuxbrew/.linuxbrew/bin/z3",
    "executable_version": "Z3 version 5.1.0 - 64 bit",
    "executable_sha256": "2ef8474af4c27919697ed1dd3011aab8c64d5f3015f4dafa400651298313b645",
    "command": [
      "/home/linuxbrew/.linuxbrew/bin/z3",
      "-in"
    ],
    "input_digest": "d3678c554eed8b684a32cd735a105d52617f695afb4c12d79da96cff62bb32ba",
    "started_at": "2026-09-12T23:43:11.641801+00:00",
    "completed_at": "2026-09-12T23:43:11.654714+00:00",
    "exit_code": 0,
    "timeout_status": false,
    "stdout_digest": "5c17dfcc2a8f1f30d9e96df6a9825a5030ade046d560332c19de74d93d591a18",
    "stderr_digest": "e3b0c44298fc1c149afbf4c8996fb92427ae41e4649b934ca495991b7852b855",
    "terminal_classification": "UNSAT_REFUTED",
    "logical_authority_class": "SOLVER_SAT_OR_UNSAT",
    "execution_metadata": {
      "raw_output_snippet": "unsat\n"
    }
  }
}