{
  "schema_version": "miskatonic.execution-trace.v0.1",
  "trace_id": "trace-smt-transform-fam-pos-05-R1_ALPHA_RENAMED-z3-real",
  "problem_id": "smt-transform-fam-pos-05-R1_ALPHA_RENAMED",
  "backend_id": "z3",
  "backend_version": "Z3 version 5.1.0 - 64 bit",
  "execution_origin": "EXECUTED_NATIVE",
  "logical_authority_class": "SOLVER_SAT_OR_UNSAT",
  "created_at": "2026-09-12T23:43:10.508771+00:00",
  "events": [
    {
      "event_id": "trace-smt-transform-fam-pos-05-R1_ALPHA_RENAMED-z3-real-ev-0000",
      "sequence": 0,
      "event_type": "INITIAL_PROBLEM",
      "backend_id": "z3",
      "backend_version": "Z3 version 5.1.0 - 64 bit",
      "parent_event_id": null,
      "state_digest": "6132c13af6b6737639112d2efd922595eae4ff3eb1832cbf0d45bcbff7863d98",
      "operation": "load_problem",
      "result_digest": "6132c13af6b6737639112d2efd922595eae4ff3eb1832cbf0d45bcbff7863d98",
      "provenance": {
        "timestamp": "2026-09-12T23:43:10.537898+00:00",
        "origin": "z3"
      },
      "logical_authority_class": "NONE",
      "event_origin": "CLIENT_DECLARED",
      "payload": {
        "formal_syntax": "; SMT Representation Equivalence Certificate (WO-MATH-FORMAL-DISCOVERY-01C)\n; Family: fam-pos-05, Stratum: R1_ALPHA_RENAMED\n(declare-const alpha_ke Int)\n(declare-const ke Int)\n(assert (= ke alpha_ke))\n(assert (not (= (+ (+ (* 1 (+ ke 0)) 0) 0) (+ (+ (* 1 (+ alpha_ke 0)) 0) 0))))\n(check-sat)\n",
        "goals": [
          "check-sat"
        ]
      }
    },
    {
      "event_id": "trace-smt-transform-fam-pos-05-R1_ALPHA_RENAMED-z3-real-ev-0001",
      "sequence": 1,
      "event_type": "TERMINAL_VERDICT",
      "backend_id": "z3",
      "backend_version": "Z3 version 5.1.0 - 64 bit",
      "parent_event_id": "trace-smt-transform-fam-pos-05-R1_ALPHA_RENAMED-z3-real-ev-0000",
      "state_digest": "6132c13af6b6737639112d2efd922595eae4ff3eb1832cbf0d45bcbff7863d98",
      "operation": "check_sat",
      "result_digest": "5c17dfcc2a8f1f30d9e96df6a9825a5030ade046d560332c19de74d93d591a18",
      "provenance": {
        "timestamp": "2026-09-12T23:43:10.537915+00:00",
        "origin": "z3"
      },
      "logical_authority_class": "SOLVER_SAT_OR_UNSAT",
      "event_origin": "BACKEND_OBSERVED",
      "payload": {
        "verdict": "UNSAT_REFUTED"
      }
    }
  ],
  "terminal_verdict": "UNSAT_REFUTED",
  "metrics": {
    "event_count": 2,
    "branch_count": 0,
    "wall_time_ms": 10.167360305786133
  },
  "problem_digest": "6132c13af6b6737639112d2efd922595eae4ff3eb1832cbf0d45bcbff7863d98",
  "execution_receipt": {
    "schema_version": "miskatonic.backend-execution-receipt.v0.1",
    "receipt_id": "rcpt-z3-smt-transform-fam-pos-05-R1_ALPHA_RENAMED-1789256590",
    "backend_id": "z3",
    "backend_family": "SMT_SOLVER",
    "execution_origin": "EXECUTED_NATIVE",
    "executable_path": "/home/linuxbrew/.linuxbrew/bin/z3",
    "executable_version": "Z3 version 5.1.0 - 64 bit",
    "executable_sha256": "2ef8474af4c27919697ed1dd3011aab8c64d5f3015f4dafa400651298313b645",
    "command": [
      "/home/linuxbrew/.linuxbrew/bin/z3",
      "-in"
    ],
    "input_digest": "6132c13af6b6737639112d2efd922595eae4ff3eb1832cbf0d45bcbff7863d98",
    "started_at": "2026-09-12T23:43:10.508771+00:00",
    "completed_at": "2026-09-12T23:43:10.518941+00:00",
    "exit_code": 0,
    "timeout_status": false,
    "stdout_digest": "5c17dfcc2a8f1f30d9e96df6a9825a5030ade046d560332c19de74d93d591a18",
    "stderr_digest": "e3b0c44298fc1c149afbf4c8996fb92427ae41e4649b934ca495991b7852b855",
    "terminal_classification": "UNSAT_REFUTED",
    "logical_authority_class": "SOLVER_SAT_OR_UNSAT",
    "execution_metadata": {
      "raw_output_snippet": "unsat\n"
    }
  }
}